{
  "$schema": "https://json-schema.org/draft/2020-12/schema",
  "$id": "https://example.invalid/picocalc/rp2040-cpu-decision.schema.json",
  "title": "PicoCalc RP2040 CPU candidate decision",
  "type": "object",
  "additionalProperties": false,
  "required": ["schema_id", "schema_version", "record_id", "candidate_id", "decision_kind", "status", "workloads", "backend_identities", "feature_set"],
  "$defs": {
    "counter": {
      "type": "integer",
      "minimum": 0
    }
  },
  "properties": {
    "schema_id": {"const": "picocalc.rp2040-cpu-decision"},
    "schema_version": {"const": 1},
    "record_id": {"type": "string", "minLength": 1},
    "candidate_id": {"type": "string", "minLength": 1},
    "status": {"enum": ["pass", "fail", "bank", "pending", "invalid", "not_run"]},
    "decision_kind": {"enum": ["admission", "correctness", "performance", "profile", "null-control", "invalid"]},
    "hypothesis": {"type": "string"},
    "candidate_backend_commit": {"type": "string", "pattern": "^[0-9a-f]{40}$"},
    "baseline_backend_commit": {"type": "string", "pattern": "^[0-9a-f]{40}$"},
    "baseline_executable_sha256": {"type": "string", "pattern": "^[0-9a-f]{64}$"},
    "candidate_executable_sha256": {"type": "string", "pattern": "^[0-9a-f]{64}$"},
    "profile_runtime_parent": {"type": "string", "pattern": "^[0-9a-f]{40}$"},
    "profile_only_delta": {"type": "string", "pattern": "^[0-9a-f]{40}$"},
    "correctness_record_sha256": {"type": "string", "pattern": "^[0-9a-f]{64}$"},
    "delta_files": {"type": "array", "minItems": 1, "items": {"type": "string", "minLength": 1}},
    "runtime_semantics_changed": {"const": false},
    "correctness_record": {"type": "string", "minLength": 1},
    "firmware_sha256": {"type": "string", "pattern": "^[0-9a-f]{64}$"},
    "target_contract_sha256": {"type": "string", "pattern": "^[0-9a-f]{64}$"},
    "scenario_sha256": {"type": ["string", "null"], "pattern": "^[0-9a-f]{64}$"},
    "host": {"type": "object"},
    "toolchain": {"type": "object"},
    "feature_set": {"type": "array", "items": {"type": "string"}},
    "workloads": {"type": "array", "items": {"type": "object"}},
    "backend_identities": {"type": "object"},
    "workload": {"type": "string", "minLength": 1},
    "trace_required": {"type": "boolean"},
    "guest_observation_sha256": {"type": "string", "pattern": "^[0-9a-f]{64}$"},
    "registered_guest_observation_sha256": {"type": "string", "pattern": "^[0-9a-f]{64}$"},
    "baseline": {"type": "object"},
    "candidate": {"type": "object"},
    "runs": {"type": "array"},
    "backend_commit": {"type": "string", "pattern": "^[0-9a-f]{40}$"},
    "runner_sha256": {"type": "string", "pattern": "^[0-9a-f]{64}$"},
    "build_provenance_sha256": {"type": "string", "pattern": "^[0-9a-f]{64}$"},
    "behavior": {"type": "object"},
    "correctness": {"type": "object"},
    "statistics": {"type": "object"},
    "filterability": {
      "type": "object",
      "additionalProperties": false,
      "required": ["method", "threshold", "workloads", "combined_ratio", "pass"],
      "properties": {
        "method": {"const": "p1b-filterable-sram-write-rate-v1"},
        "threshold": {"type": "number", "minimum": 0},
        "workloads": {
          "type": "array",
          "minItems": 2,
          "items": {
            "type": "object",
            "additionalProperties": false,
            "required": [
              "workload", "sram_write_requests",
              "non_executable_sram_write_requests", "filterable_request_rate"
            ],
            "properties": {
              "workload": {"type": "string", "minLength": 1},
              "sram_write_requests": {"$ref": "#/$defs/counter"},
              "non_executable_sram_write_requests": {"$ref": "#/$defs/counter"},
              "filterable_request_rate": {"type": "number", "minimum": 0}
            }
          }
        },
        "combined_ratio": {"type": "number", "minimum": 0},
        "pass": {"type": "boolean"}
      }
    },
    "evidence": {"type": "array"},
    "reasons": {"type": "array", "items": {"type": "string"}},
    "artifacts": {"type": "object"},
    "measurement_policy": {
      "oneOf": [
        {
          "type": "object",
          "additionalProperties": false,
          "required": [
            "inter_run_cooldown_seconds", "calibration_method", "anchor_layout",
            "anchor_run_ids", "correction_method", "anchor_residual_threshold",
            "pair_level_sensitivity_method"
          ],
          "properties": {
            "inter_run_cooldown_seconds": {"type": "number", "minimum": 0},
            "primary_metric": {"enum": ["cpu-time", "wall-time"]},
            "calibration_method": {"const": "interleaved-anchor-v1"},
            "anchor_layout": {
              "type": "object",
              "additionalProperties": false,
              "required": ["pre_count", "after_measured_runs", "post_count"],
              "properties": {
                "pre_count": {"const": 3},
                "after_measured_runs": {"const": [10, 20, 30]},
                "post_count": {"const": 3}
              }
            },
            "anchor_run_ids": {
              "const": [
                "anchor-pre-001", "anchor-pre-002", "anchor-pre-003",
                "anchor-after-010", "anchor-after-020", "anchor-after-030",
                "anchor-post-001", "anchor-post-002", "anchor-post-003"
              ]
            },
            "correction_method": {"const": "piecewise-linear-interpolation-of-log-baseline-anchor-throughput-v1"},
            "anchor_residual_threshold": {"const": 0.02},
            "pair_level_sensitivity_method": {"const": "raw-vs-host-corrected-log-ratio-v1"}
          }
        },
        {
          "type": "object",
          "additionalProperties": false,
          "required": [
            "inter_run_cooldown_seconds", "calibration_method", "anchor_layout",
            "anchor_group_ids", "anchor_run_ids", "correction_method",
            "anchor_aggregation_method", "anchor_residual_threshold",
            "anchor_local_residual_method", "anchor_local_residual_threshold",
            "anchor_group_dispersion_gate_used", "anchor_group_dispersion_threshold",
            "pair_level_sensitivity_method", "pair_level_sensitivity_gate_used",
            "pair_level_sensitivity_threshold", "global_residual_diagnostic_only"
          ],
          "properties": {
            "inter_run_cooldown_seconds": {"type": "number", "minimum": 0},
            "primary_metric": {"enum": ["cpu-time", "wall-time"]},
            "calibration_method": {"const": "interleaved-anchor-v3"},
            "anchor_layout": {
              "type": "object",
              "additionalProperties": false,
              "required": ["pre_count", "after_measured_runs", "post_count", "replicates_per_group"],
              "properties": {
                "pre_count": {"const": 3},
                "after_measured_runs": {"const": [5, 10, 15, 20, 25, 30, 35]},
                "post_count": {"const": 3},
                "replicates_per_group": {"const": 3}
              }
            },
            "anchor_group_ids": {
              "const": ["pre", "after-005", "after-010", "after-015", "after-020", "after-025", "after-030", "after-035", "post"]
            },
            "anchor_run_ids": {
              "const": [
                "anchor-pre-001", "anchor-pre-002", "anchor-pre-003",
                "anchor-after-005-001", "anchor-after-005-002", "anchor-after-005-003",
                "anchor-after-010-001", "anchor-after-010-002", "anchor-after-010-003",
                "anchor-after-015-001", "anchor-after-015-002", "anchor-after-015-003",
                "anchor-after-020-001", "anchor-after-020-002", "anchor-after-020-003",
                "anchor-after-025-001", "anchor-after-025-002", "anchor-after-025-003",
                "anchor-after-030-001", "anchor-after-030-002", "anchor-after-030-003",
                "anchor-after-035-001", "anchor-after-035-002", "anchor-after-035-003",
                "anchor-post-001", "anchor-post-002", "anchor-post-003"
              ]
            },
            "correction_method": {"const": "piecewise-linear-interpolation-of-log-baseline-anchor-group-median-throughput-v3"},
            "anchor_aggregation_method": {"const": "median-of-replicate-log-throughput-v1"},
            "anchor_residual_threshold": {"const": 0.02},
            "anchor_local_residual_method": {"const": "leave-one-group-out-log-linear-v1"},
            "anchor_local_residual_threshold": {"const": 0.02},
            "anchor_group_dispersion_gate_used": {"const": true},
            "anchor_group_dispersion_threshold": {"const": 0.02},
            "pair_level_sensitivity_method": {"const": "raw-vs-host-corrected-log-ratio-v1"},
            "pair_level_sensitivity_gate_used": {"const": true},
            "pair_level_sensitivity_threshold": {"const": 0.02},
            "global_residual_diagnostic_only": {"const": true}
          }
        },
        {
          "type": "object",
          "additionalProperties": false,
          "required": [
            "inter_run_cooldown_seconds", "calibration_method", "anchor_layout",
            "anchor_group_ids", "anchor_run_ids", "correction_method",
            "anchor_aggregation_method", "anchor_residual_threshold",
            "anchor_group_dispersion_gate_used", "anchor_group_dispersion_threshold",
            "pair_level_sensitivity_method"
          ],
          "properties": {
            "inter_run_cooldown_seconds": {"type": "number", "minimum": 0},
            "primary_metric": {"enum": ["cpu-time", "wall-time"]},
            "calibration_method": {"const": "interleaved-anchor-v2"},
            "anchor_layout": {
              "type": "object",
              "additionalProperties": false,
              "required": ["pre_count", "after_measured_runs", "post_count", "replicates_per_group"],
              "properties": {
                "pre_count": {"const": 3},
                "after_measured_runs": {"const": [10, 20, 30]},
                "post_count": {"const": 3},
                "replicates_per_group": {"const": 3}
              }
            },
            "anchor_group_ids": {
              "const": ["pre", "after-010", "after-020", "after-030", "post"]
            },
            "anchor_run_ids": {
              "const": [
                "anchor-pre-001", "anchor-pre-002", "anchor-pre-003",
                "anchor-after-010-001", "anchor-after-010-002", "anchor-after-010-003",
                "anchor-after-020-001", "anchor-after-020-002", "anchor-after-020-003",
                "anchor-after-030-001", "anchor-after-030-002", "anchor-after-030-003",
                "anchor-post-001", "anchor-post-002", "anchor-post-003"
              ]
            },
            "correction_method": {"const": "piecewise-linear-interpolation-of-log-baseline-anchor-group-median-throughput-v2"},
            "anchor_aggregation_method": {"const": "median-of-replicate-log-throughput-v1"},
            "anchor_residual_threshold": {"const": 0.02},
            "anchor_group_dispersion_gate_used": {"const": true},
            "anchor_group_dispersion_threshold": {"const": 0.02},
            "pair_level_sensitivity_method": {"const": "raw-vs-host-corrected-log-ratio-v1"}
          }
        },
        {
          "type": "object",
          "additionalProperties": false,
          "required": [
            "method", "pairs", "measured_runs", "order_schedule", "warmup_runs",
            "inter_run_cooldown_seconds", "calibration_method", "primary_metric",
            "secondary_metric", "affinity", "host_timing_scope", "diagnostic_only",
            "promotion_requires_full_production_ab"
          ],
          "properties": {
            "method": {"const": "paired-cpu-screening-v1"},
            "pairs": {"const": 2},
            "measured_runs": {"const": 8},
            "order_schedule": {"const": ["AB", "BA"]},
            "warmup_runs": {"const": 0},
            "inter_run_cooldown_seconds": {"const": 0},
            "calibration_method": {"const": "none"},
            "primary_metric": {"const": "cpu-time"},
            "secondary_metric": {"const": "wall-time"},
            "affinity": {"const": "single-vcpu"},
            "host_timing_scope": {"const": "picocalc-harness::run_loop"},
            "diagnostic_only": {"const": true},
            "promotion_requires_full_production_ab": {"const": true}
          }
        },
        {
          "type": "object",
          "additionalProperties": false,
          "required": ["inter_run_cooldown_seconds"],
          "properties": {
            "inter_run_cooldown_seconds": {"type": "number", "minimum": 0}
          }
        }
      ]
    }
  },
  "allOf": [
    {
      "if": {"properties": {"decision_kind": {"const": "admission"}}},
      "then": {"required": ["evidence", "correctness"]}
    },
    {
      "if": {"properties": {"decision_kind": {"const": "correctness"}}},
      "then": {"required": ["correctness"]}
    },
    {
      "if": {"properties": {"decision_kind": {"const": "performance"}}},
      "then": {"required": ["statistics", "correctness"]}
    },
    {
      "if": {"properties": {"decision_kind": {"const": "null-control"}}},
      "then": {"required": ["statistics", "correctness"]}
    },
    {
      "if": {"properties": {"decision_kind": {"const": "profile"}}},
      "then": {"required": ["correctness"]}
    },
    {
      "if": {"properties": {"decision_kind": {"const": "invalid"}}},
      "then": {"required": ["reasons"]}
    }
  ]
}
