{
  "backend_identities": {
    "baseline_production": {
      "build_provenance_sha256": "d47660fe9807f6ab79a072423cbd147cacd5e0bc8bfaaa17ae552b04a4af37bb",
      "commit": "73784b96a1afdb34dc1a79577f947b670a138d07",
      "dirty": false,
      "feature_set": [
        "sd-gen1-multiblock"
      ],
      "provenance_role": "production",
      "role": "baseline_production",
      "runner_sha256": "921c923df12d88e0fa8edda470ffff252f62d3047f1836c3080ada824fae25c7"
    },
    "candidate_production": {
      "build_provenance_sha256": "d47660fe9807f6ab79a072423cbd147cacd5e0bc8bfaaa17ae552b04a4af37bb",
      "commit": "73784b96a1afdb34dc1a79577f947b670a138d07",
      "dirty": false,
      "feature_set": [
        "sd-gen1-multiblock"
      ],
      "provenance_role": "production",
      "role": "candidate_production",
      "runner_sha256": "921c923df12d88e0fa8edda470ffff252f62d3047f1836c3080ada824fae25c7"
    }
  },
  "candidate_id": "P0-A2",
  "correctness": {
    "status": "pass",
    "workloads": [
      "picotetris-opt1b-vrp5",
      "picoedit-r1-vrp2f"
    ]
  },
  "decision_kind": "correctness",
  "feature_set": [
    "sd-gen1-multiblock"
  ],
  "host": {
    "allowed_cpus": [
      0,
      1,
      2,
      3,
      4,
      5,
      6,
      7,
      8,
      9,
      10,
      11
    ],
    "kernel": "6.18.33.2-microsoft-standard-WSL2",
    "loadavg": [
      0.0380859375,
      0.26025390625,
      0.31689453125
    ],
    "logical_cpus": 12,
    "model": "AMD Ryzen 5 5600X 6-Core Processor",
    "platform": "Linux-6.18.33.2-microsoft-standard-WSL2-x86_64-with-glibc2.39",
    "reported_mhz": 3693.107
  },
  "record_id": "rp2040-cpu-p0-null-v3-20260901-01",
  "schema_id": "picocalc.rp2040-cpu-decision",
  "schema_version": 1,
  "status": "pass",
  "workloads": [
    {
      "contract_sha256": "1a296b1faa9088e22f9939bc61b3963475af7005343038361cf1db4ddcb28a5f",
      "firmware_sha256": "0784d80d0d00c9bf86d06e903234bc022db5bda2ff193e17533c65b9c2546e62",
      "id": "picotetris-opt1b-vrp5",
      "revision": 10,
      "scenario_sha256": "b1cefa5c24eb20739e67f60980898b45e4feba00846c61ef5092bff341aaf208"
    },
    {
      "contract_sha256": "ad3b795ca89a9350766a6be7a833c09c35113c2bddebc0a3b6cc458e81b8a6c9",
      "firmware_sha256": "17cb513b8dd3ea6525ce6bd92d1ce3081bb6ea9730c590c2afb86a9fa085e8f6",
      "id": "picoedit-r1-vrp2f",
      "revision": 4,
      "scenario_sha256": "d7af28965f49cd7363ca5ac68678572d3e6975eb426b6af828dd09a70505b718"
    }
  ]
}
